[
  {
    "name": "Kaziyami: Hanime",
    "pkg": "eu.kanade.tachiyomi.animeextension.en.hanime",
    "apk": "kaziyami-en.hanime-v14.1.apk",
    "lang": "en",
    "code": 1,
    "version": "14.1",
    "nsfw": 1,
    "hasReadme": 0,
    "hasChangelog": 0,
    "sources": [
      {
        "name": "Hanime",
        "lang": "en",
        "id": "2150907185602526076",
        "baseUrl": "https://hanime.tv"
      }
    ]
  },
  {
    "name": "Kaziyami: Hentaimama",
    "pkg": "eu.kanade.tachiyomi.animeextension.en.hentaimama",
    "apk": "kaziyami-en.hentaimama-v14.1.apk",
    "lang": "en",
    "code": 1,
    "version": "14.1",
    "nsfw": 1,
    "hasReadme": 0,
    "hasChangelog": 0,
    "sources": [
      {
        "name": "Hentaimama",
        "lang": "en",
        "id": "8058423919997530503",
        "baseUrl": "https://hentaimama.io"
      }
    ]
  },
  {
    "name": "Kaziyami: JAVSubbed",
    "pkg": "eu.kanade.tachiyomi.animeextension.en.javsubbed",
    "apk": "kaziyami-en.javsubbed-v14.1.apk",
    "lang": "en",
    "code": 1,
    "version": "14.1",
    "nsfw": 1,
    "hasReadme": 0,
    "hasChangelog": 0,
    "sources": [
      {
        "name": "JAVSubbed",
        "lang": "en",
        "id": "9192959167101688940",
        "baseUrl": "https://javsubbed.net"
      }
    ]
  },
  {
    "name": "Kaziyami: IndoHentai",
    "pkg": "eu.kanade.tachiyomi.animeextension.id.indohentai",
    "apk": "kaziyami-id.indohentai-v14.1.apk",
    "lang": "id",
    "code": 1,
    "version": "14.1",
    "nsfw": 1,
    "hasReadme": 0,
    "hasChangelog": 0,
    "sources": [
      {
        "name": "IndoHentai",
        "lang": "id",
        "id": "7369497329911250289",
        "baseUrl": "https://indohentai.net"
      }
    ]
  },
  {
    "name": "Kaziyami: Nekopoi",
    "pkg": "eu.kanade.tachiyomi.animeextension.id.nekopoi",
    "apk": "kaziyami-id.nekopoi-v14.1.apk",
    "lang": "id",
    "code": 1,
    "version": "14.1",
    "nsfw": 1,
    "hasReadme": 0,
    "hasChangelog": 0,
    "sources": [
      {
        "name": "Nekopoi",
        "lang": "id",
        "id": "7073589375897212735",
        "baseUrl": "https://nekopoi.care"
      }
    ]
  },
  {
    "name": "Kaziyami: NontonHentai",
    "pkg": "eu.kanade.tachiyomi.animeextension.id.nontonhentai",
    "apk": "kaziyami-id.nontonhentai-v14.1.apk",
    "lang": "id",
    "code": 1,
    "version": "14.1",
    "nsfw": 1,
    "hasReadme": 0,
    "hasChangelog": 0,
    "sources": [
      {
        "name": "NontonHentai",
        "lang": "id",
        "id": "7400791378172011716",
        "baseUrl": "https://nontonhentai.net"
      }
    ]
  }
]